{"schema_version":"2.0.0","lifecycle_id":"LCR-C05-001","assessment_id":"ASM-DEMO-001","evidence_id":"EVD-POLICY-001","state":"INTEGRITY_VERIFIED","recorded_at":"2026-09-10T10:02:00Z","recorded_by":"INTEGRITY-VERIFIER","actor_type":"DETERMINISTIC_RULES","sha256":"aaaaaaaaaaaaaaaaaaaaaaaaaaaaaaaaaaaaaaaaaaaaaaaaaaaaaaaaaaaaaaaa"}
